listing_id,id,date,reviewer_id,reviewer_name,comments
58506,622936527,2022-02-08,341871681,Sean,"Despite being in a global lockdown situation, Yindi and our hosts provided exceptional hospitality. The space in Yindi Studio provides a bright, airy and funky living and working area. The floor to ceiling windows can be drawn back allowing the noise of wildlife to fill the space, as well as cool it down quickly. <br/>The garden and patio is well maintained and a great place to enjoy dining outdoors..<br/>If you like walking this place is a perfect base to explore Sydney Harbourview National Park as well as the retail opportunities available in Mosman and beyond."
58506,609410035,2022-02-08,207675348,Darren,Great location. Johns interaction and area knowledge extremely helpful. Suburb has a great vibe and hospitality facilities
58506,608500142,2022-02-08,275485771,Joan,Place looking tired and cluttered and needs a lot of attention
58506,598379926,2022-02-08,317597717,Kate,"Nice and quiet, a bit tired. Easy street parking in a lovely area."
58506,593130721,2022-02-08,79226178,Gerry,"It’s a reasonable space, but appeared tired and worn. Expected a greater level of cleanliness throughout. There is only 2 cooking rings in kitchen, no oven and a very small TV.<br/>The unit is in a quiet residential area, but it is very hilly if you are walking, and Mosman shops are 20 minute walk."
58506,589425143,2022-02-08,2120581,Anton,"This is a large, modern, bright, open space.  It has everything you need for a comfortable stay.  John is a flexible, welcoming host who provides great tips about local amenities and transportation.  You are relatively close to a remarkable and stylish restaurant and shopping area.  Taronga Zoo is a short bus ride away as are ferries to the city.  There is quick bus service to the city almost at your doorstop.  The only drawback is that the bus is only hourly and does not operate Sunday evenings.  Other buses are a bit of a hike away, over hilly streets.  If you are happy to be out of the center of the city - and there are reasons to be - this is an excellent choice.  The value for such a large, sophisticated space is excellent."
58506,584332931,2022-02-08,255591507,Carole,"Exactly what it says on the tin! Comfortable, pleasant, good location and friendly, helpful hosts."
58506,581081120,2022-02-08,129025610,Kate,Another great stay at Studio Yindi! Perfect for kids. We hope to be back.
58506,767617231,2022-02-08,275604326,Cherrie,"A beautiful little hidden gem that we were over joyed to find! <br/>The on street parking was a little difficult at times but well worth it for the beautiful view you wake up to each morning. Not only did it have all the comforts of home, John was more than happy to arrange early check in. The whole area is full of wonderful places to see and only 5 mins drive from The Four Frogs Creperie... Definitely worth visiting!"
58506,578797927,2022-02-08,313508212,Shane,"Bus is close, nice home environment better than a motel for a family group."
58506,768477074,2022-02-08,21001258,Kristian,"We really enjoyed our stay with John and Pam. The studio is well appointed, quite large, clean and comes with access to a well maintained garden. The location is close to the water and within walking distance to shops, restaurants and public transport. John and Pam are lovely and went out of their way to make our stay as comfortable as possible. Highly recommended!"
58506,388578063563901392,2022-02-08,12407483,John,"Absolutely amazing location, and place was fantastic, so much room for us and our two small children. Easy to get around and the John was fantastic with us booking late - highly recommend"
58506,556064905135040489,2022-02-08,28741271,Suzanne,Great self contained unit with outside space. Walkable to all local amenities and attractions.
58506,542203198614212450,2022-02-08,110391371,Denise,Great location in Mosman - well located to access the zoo and walk to Balmoral.  Welcoming and lovely hosts.
58506,540106872451108956,2022-02-08,303441,Aaron,"Lovely spot and gracious hosts. Fantastic place to stay, highly recommended"
58506,534838710385455440,2022-02-08,111245116,Natalie,"Unfortunately due to a Covid scare within my household the day I was supposed to check in, I wasn’t able to make the reservation. John was very understanding of the situation and I was so appreciative of that. I look forward to rebooking my stay as soon as I can."
58506,530672503107165321,2022-02-08,273249881,Shanira,"Such a beautiful studio, clean and comfortable, with all the amenities you need and excellent location close to the local beaches and city. The hosts are also so kind and helpful. Really enjoyed out stay!"
58506,529234890379166328,2022-02-08,68147905,Caro,"What a gem! This is a lovely space in a quiet area tucked away in a beautiful part of Sydney. The unit is set up as a very comfortable and relaxing space, with easy access and parking. <br/><br/>John and Pam are lovely hosts who made sure we had what we needed and shared a bit of what life is like living in Mosman. We couldn’t ask for better communication. <br/><br/>We highly recommend this stay for anyone looking for a quiet and comfortable getaway in a beautiful area."
58506,525586204754681364,2022-02-08,9768120,Jacquetta,Studio Yindi is a wonderful haven in Sydney and  was a great place for us to base ourselves.  The garden is gorgeous and the space is multifunctional. We loved our stay - and John and Pam were delightful hosts.
58506,516936569579062067,2022-02-08,6678795,Giulietta,John and Pam's place was perfect for us and our 3 year old. A bright and airy space equipped with everything you could possibly need and a lovely garden to explore. The hosts made us feel very welcome and even put our shopping order in the fridge for us before our arrival. <br/>I'd happily come back and stay next time we're in Sydney!
58506,512515250832836861,2022-02-08,15841187,Megan,"Studio Yindi @ Mosman was exactly as described and was very suitable for us wanting a great value place to crash while in Sydney for a couple of days for work, 2 adults & 1 toddler."
58506,506778729136985121,2022-02-08,212895960,Kerrie,Wonderful property.<br/>John is a fabulous host and highly recommend the property very convenient and quiet.
58506,505236342587972132,2022-02-08,233071437,Oskar,10/10 highly recommend!!
58506,495861284152586797,2022-02-08,12279106,Douglas,Great place to stay in Mosman.
58506,492939141539448426,2022-02-08,27387746,Lesley,Lovely owners and a perfect place to stay.  thank you so much.
58506,458244182117755971,2022-02-08,285261275,Robert,"Thank you to John for being such a wonderful and helpful host. It has been a pleasure staying here, we have thoroughly enjoyed our time."
58506,392976418808160879,2022-02-08,387464191,Chon,"Thank you John and Pam for a lovely and comfortable stay, your beautiful home was the perfect location to shops, function venues and sights such as Taronga zoo, Manly etc.<br/>Clean, quiet and tidy and the bed sheets were clean and smells fresh ! thank you for the extra blankets provided especially during this cooler months.<br/>Thank you last but not least for always communicating with us if we have any questions, we really had a lovely stay.<br/>Thank you"
58506,770671789,2022-02-08,132585384,Michelle,"Very happy to recommend this place. There was a bit of noise concerns from the hosts living above which resulted in some undesirable 7am starts to the day, but only on 2 out of the 5 nights we stayed, and this was definitely made up for by the beautiful view and location, and very friendly hosts, who were understanding and apologetic."
58506,578208971,2022-02-08,219445834,Olivier,Nice place to stay in Sydney... only 20 minutes by bus to the city !! I will recommended to stay
58506,574935978,2022-02-08,314890176,Sayeed Ibn,Excellent
58506,573335740,2022-02-08,305418739,Max,The airbnb is amazing. You have a lot of room and the hosts are really nice. They even came around and explained some things about Mosman to us and what we can do there. It was super clean too!
58506,452309702,2022-02-08,50087689,Gary,"John was a terrific host. Very knowledgeable about the area, things to do and see and how to get around. The studio was also exactly what we needed. Had a great stay!"
58506,449920486,2022-02-08,123673179,Rodney,"Lovely location, great place and John is a great host"
58506,449075293,2022-02-08,222827481,Gertrud Elisabeth,"Bewertung für die Unterkunft <br/><br/>Studio ""Yindi "" in Sydney RD House Mosmann 28 Congewoi <br/><br/>Das Studio war sehr hell und schön. Es war alles vorhanden was wir brauchten und sehr gepflegt.<br/><br/>John war sehr freundlich und vor allem sehr hilfsbereit. Seine Ausflugstipps waren sehr wertvoll.<br/><br/>Ich empfehle diese Unterkunft unbedingt weiter!"
58506,438899562,2022-02-08,14998709,Leanne,"We had a wonderful stay at Studio Yindi.  John and Pam are wonderful hosts - their communication was excellent and the perfect balance of information, which respecting privacy. The panorama windows provide the loveliest garden outlook - so peaceful, but yet so close to everything. The studio is very comfortable and homely with everything you need. It is so spacious with a large relaxing  lounge area and separate dining .. as well as outdoor seating in the lovely yard.  The bedding set up is great with privacy in such a lovely  open space. The comfortable beds and the extras of great coffee and a few supplies made for a great couple of days!! Thank you John and Pam."
58506,436771045,2022-02-08,239818357,Lisa,"The accommodation is in a beautiful location, private, self contained and very clean and tidy. No need for a car as public transport is excellent. John and Pam are excellent hosts."
58506,433677290,2022-02-08,10513014,Mirjam,"Studio Yindi is a very generous space with panorama windows into greenery. Very comfy masterbed in loft-style main space; kids were happily tucked away in the small bedroom. If you're lacking anything, just ask John and his lovely wife and they will surely try to assist!"
58506,432752699,2022-02-08,25973120,Carol,"Unfortunately this was THE WORST Airbnb we have ever stayed in. <br/>Obviously you get what you pay for. But I didn’t expect the uncleanliness we experienced here. <br/>The pillows were old and had a disgusting odour. The bed linen was old and didn’t feel clean. There was a hole in the ceiling above the bed. <br/>The kitchen table was sticky. The dishwashing liquid was empty. The cutlery was dirty. <br/>There was a disgusting odour coming from the bathroom floor drain. <br/>Both bottles of soap in the shower were were empty. One had a small amount watered down. No shampoo or conditioner. <br/>The windows and entry glass doors were filthy. <br/>The floor was sticky near the entry. <br/>There was dust and cobwebs. <br/>It was NOISY. <br/>We could here the hosts above us talking, walking around, and moving furniture. All evening!<br/>The neighbours were only a couple of metres away so we could hear them clearly. And they were LOUD!<br/>At 7 am they started sanding the deck next door metres from our bed. <br/>We packed up and left. Even though we were booked in for a second night. <br/>IT WAS A NIGHTMARE."
58506,431443260,2022-02-08,33717669,Christopher,"John and Pam were so lovely and so helpful with everything, they really went the extra mile for us. The studio is great with huge airy windows. We stayed for a month with our 7month old baby and it was a great place to stay as a family."
58506,417329422,2022-02-08,182517937,Holly,"John is a great friendly host who is very knowledgeable and helpful. His place is great value for money, great large studio with basic kitchen, really comfy beds and close to public transport. We really enjoyed our stay here."
58506,415926420,2022-02-08,200468750,Alberto,"Muy bien, todo bien"
58506,414199770,2022-02-08,77760392,Stephen,John and his wife were brilliant hosts. They took the time to welcome us into their house and answered any queries we had. They were very knowledgeable about the transportation in and around Brisbane. Would definitely stay again
58506,412956739,2022-02-08,223917281,Rebecca,Great place and John was lovely!
58506,409829815,2022-02-08,25252227,Suzy,"Studio Yindi is an absolute gem. John and Pam are fabulous hosts and have thought of everything. I stayed in the studio for a month and they went out of their way to make me feel at home, and ensure I had everything I needed.<br/>The studio is larger than it looks in the photos and very well equipped. There’s lots of natural light and a lovely garden to enjoy.<br/>It’s one of the best Airbnb’s I’ve stayed in - you can tell they’ve put a lot of time and care into making it welcoming and comfortable.<br/>Highly recommend!"
58506,400377494,2022-02-08,191507627,Daniela,Super tolle Unterkunft mit netten Gastgebern!
58506,367481840,2022-02-08,103160493,Karen,Great value accommodation in fantastic location. Lovely setting made us feel we were in nature not in the middle of a major city.
58506,457812669,2022-02-08,246879675,Kyung Ok,의사소통이 잘 되었고 호스트분들은 아주 친절했어요. 도움이 필요할때마다 적극 도와주셨어요. 첫날 도착했을때 아이가 있어어 배고플까봐 늦은밤인데도 마트까지 데려다주셨어요. 동네는 치안이 아주 좋았고 깨끗했어요. 시티는 아니지만 시티에 가는 버스노선이 많았어요. 출퇴근시간에는 243번이 자주오지만 낮에는 한시간에 한대만 와요. 하지만 시간표보고 시간표에 맞춰 다니면 많이 불편하지 않아요. 최근 안좋은 후기보고 가기전에 걱정했지만 저는 불편하지않고 잘 지내고 왔어요. 옆집은 공사했지만 많이 시끄럽지 않았어요. 거의 신경쓰이지 않았어요. 호스트분들이 넘 친절하시고 잘 머물고왔습니다
58506,459147173,2022-02-08,165337502,Joshua,"John's place was great for my weekend in Sydney. Location was ideal for my needs to visit family in surrounding suburbs but also a short trip into the CBD. The apartment was spacious and had everything I needed, and was nice and clean. <br/><br/>John was a great host, he made check in and out very easy and was very quick to respond to any messages I sent through."
58506,462124032,2022-02-08,45612058,Sharyn,Great studio perfect for our family of four. It had everything we needed and more.
58506,516780149,2022-02-08,268856202,Dearne,Very peaceful quiet location while still close to everything you possibly could need on your stay . Very clean and comfortable accommodation and will definitely book again . Thanks  john for all your help you are a very accommodating man . Overall a fantastic experience
58506,568030519,2022-02-08,152690685,Andrew,"It was a fantastic place to stay, a quick walk down to the water.  John was very hospitable, even when we were very delayed with our flight 6 hours behind schedule.  He went out of his way to make sure we were as comfortable as possible.  He went above and beyond.  The property is nice and privately located at the back of the residence.  It was a nice relaxing respite from our busy trip."
58506,566593253,2022-02-08,46589663,Lucy,I’d rather not say. Have given feedback to owner.
58506,564915566,2022-02-08,85398736,Frances,Lovely quiet location in Mosman. Nice relaxing outdoor area. Walking distance to Spit junction. Nice open space
58506,564086310,2022-02-08,244047696,Sandra,A lovely basic private space close to many areas of Sydney. The hosts are very knowledgeable and thoughtful.
58506,560814202,2022-02-08,273651832,Dean,Friendly and hospitable. Great leafy residence in a quiet corner of Mosman.
58506,558368800,2022-02-08,24885479,Jo,"Friendly hosts, nice private area with a lovely little garden for my baby and i to relax in. Hosts very kindly gave us the use of a highchair while we were there. A gem!"
58506,556583299,2022-02-08,596019,Jen,We stayed at Studio Yindi for two nights and thoroughly enjoyed ou
58506,362215542,2022-02-08,200049379,Justin,"Everything was great,no complaints. Had everything we needed, great location. Neat and tidy,not far from anything really. John was a fantastic host with a lot of local knowledge. Highly recommend and will be back in the future.. Cheers"
58506,555703674,2022-02-08,47170528,Kerry,Fantastic little piece of paradise in a very quiet area that is close to all that the northern beaches have to offer. Very reasonable price for a large space.
58506,553342587,2022-02-08,11113072,Ulrike,"To stay at Johns and Pams house was a great experience. They are extremly helpful, very kind, open hearded, child-friendly, interesting conversation partners and they think about our needs especialy as a family in Sydney (the welcome-milk in the fridge for the kids for example was awsome :) <br/>Grocery stores are 15 minutes by walk, the busstation 2 minutes, one nice playground 4 minutes and the neighbourhood is very nice and quiet.  In short: fantastic accommodation!!!"
58506,545731420,2022-02-08,21869037,Chris,"John’s place was perfect for our short stay for a wedding. We were welcomed with a lovely bottle of wine, and milk and John was very helpful with our questions. <br/>Thanks for your hospitality John."
58506,544755633,2022-02-08,25472080,Alex,"John greeted us at the door when we checked in and made us feel very comfortable throughout our stay. He lent me and my kids cards for public transport and gave us some advice on where to go to see the sights and walk in the parks. The space was compact, simple and very comfortable. The location was also fantastic, only a short trip to trains, ferries and the zoo."
58506,540161573,2022-02-08,42964833,Terry,Value for money!!! Street parking easy and close!
58506,537599249,2022-02-08,42889924,Sue,Yindi Studio is bright and spacious and overlooks a small garden.  It is perfect for a stay in Mosman - we will return again. John and Pamela were very friendly and  considerate hosts.
58506,530542035,2022-02-08,293642782,Giada,Good place to be! Very welcoming people! Close to everything !
58506,525487070,2022-02-08,35517146,Helen,Studio Yindi suited us perfectly for our four days in Sydney for a family wedding. It had everything we needed and was comfortable and economical. We weren’t there enough to enjoy the garden but with four adults staying there we valued the generous living spaces. The location is great and John was a friendly and welcoming host.
58506,554228299,2022-02-08,226940494,Jessah,"Excellent accommodation, great location, spot-on communication."
58506,108693126,2022-02-08,22416658,Brendan,"John made us very welcome and provided us with local information regarding bus and ferry services etc. Space was big enough to sleep, lie around and use kitchen."
58506,361129154,2022-02-08,3350164,Felipe,We enjoy our stay this place
58506,107288429,2022-02-08,19712428,Lynette,"We had a lovely stay here across our family wedding weekend. <br/><br/>John was very helpful accommodating early check in and late check out for us which was greatly appreciated.<br/><br/>The street and area was lovely and quiet and the studio had a lovely relaxed outlook across the small backyard garden with water glimpses of you wander down the pathway. The sounds of only birds chirping was lovely.<br/><br/>The open plan layout was perfect for what we needed to get ready for the wedding and also have a nice relaxing outlook.<br/><br/>I was the bride staying their Friday night with my parents and 10 month old son. John brought down son additional toys and was very thoughtful. Saturday night my parents, sister and her partner stayed and had an enjoyable stay also.<br/><br/>We are very grateful for the gorgeous little place so practical and so close to our wedding ceremony and reception at the spot so great for the family :-) <br/><br/>Thank you to John for being so helpful and flexible. It was a lovely find. Would be nice to come back soon to reminisce our special day. "
58506,7815529,2022-02-08,8836737,Emma,Studio Yindi offered simple accommodation with everything we needed at a great price. The location was brilliant and the host excellent (thanks John). There was plenty of space and having a garden was really good (especially with kids). Would certainly recommend.
58506,4815867,2022-02-08,6326015,Najieb,John's place was in a nice suburb close to public transport.john himself is a very nice person and he is very helpful regarding any concerns you may have his place is more suited for a family with kids but we had fun so I suppose anyone can .
58506,4604846,2022-02-08,524675,Sally,"We really enjoyed our stay at Studio Yindi.  John was a welcoming and helpful host (assisting us with navigating Sydney) by providing us with directions and maps.  The place is great value dollars wise (compared to booking a hotel room!).  The accommodation is very spacious, clean, the beds comfortable and warm.  
<br/>
<br/>It is also located in the lovely North Shore of Sydney - Taronga Zoo is a 5 minute drive and city 10-15mins...  We will definately stay here again on our next Sydney adventure...
<br/>"
58506,4116088,2022-02-08,5050767,Anne-Jo,"We had a great time in the spacious apartment in the beautiful neighbourhood Mosman. At the end of the street, you can take the bus. Within 15 minutes you're downtown. With a family with two young children, this was a good deal. Yohn is nice and helpful host. "
58506,3979302,2022-02-08,2777628,Valerie,"Well we were rather surprised to find that the area was so  hilly when we arrived, thank goodness we decided to get a cab from the city. My husband has Emphysema and had I known the area I would not have booked it. We actually found it to be quite noisy from the owners above they didn't seem to be concerned that there were guests in the flat under them and it sounded morning and night like a herd of elephants above us, also I don't know that the door that divide to owners house from the flat I didn't think afforded that much privacy, they appeared to be very flimsy and we were always hearing scratching noises, which was a bit disconcerting. I think it is a fairly cheap sort of set up and not what I would consider any more than 3 stars at the most. We would not stay there again.
<br/>"
58506,3928092,2022-02-08,5101932,Joyce,"We stayed two nights at Studio Yindi which is airy and spacious, located in a safe and leafy suburb. It is 5 mins drive to the beautiful Balmoral Beach. We know Sydney quite well already and so John let us enjoy absolute privacy during our stay. We had no problems finding parking. Thanks John for a wonderful stay! "
58506,3857192,2022-02-08,3564981,Alena,My mother and I enjoyed staying at John's spacious Studio Yindi which has a very pleasant garden. The location is probably the best for those with a car. But if you don't mind a ten minute walk up the road to the shops and main road or have patience to wait for public transport or taxi then the place would be ideal as it really gives a sense of home. We did not have a chance to talk to John much as we were busy running around but it is obvious that he hosted many happy travellers from around the world and can provide a good advice on things to do to explore Sydney.
58506,3565689,2022-02-08,4150446,Mirja,"We had a lovely time in Sydney och Studio Yindi, which is a prefect place to stay. Close to nice beaches and not too far from CBD. "
58506,3491553,2022-02-08,2105307,Wendy,"We loved staying at Studio Yindi. The apartment is spacious and has lots of daylight and Pam and John are very friendly and helpful. On the first day, John showed us around the area for shopping facilities. He was also very helpful with any ""travel needs"" we had, e.g. printing airline tickets etc. 
<br/>
<br/>The area is very quiet and safe. There are walking trails nearby. There is a nice Yoga Studio close by. Balmoral Beach (with the best Fish&Chips :-) ) Is up the hill and down again, about 20 minutes walking.
<br/>
<br/>We definitely recommend the studio for your visit to Sydney and would go back anytime."
58506,3445713,2022-02-08,3377045,Stefan,The reservation was canceled 32 days before arrival. This is an automated posting.
58506,3320761,2022-02-08,4042211,Raz,"Our stay at the Studio Yindi as very pleasant. The location is good, and there is no problem getting into the city center. The apartment is spacious and convinient and the host, John Young, is very helpful and hospitable. Highly recommended."
58506,3219657,2022-02-08,4045664,Anders,"Stayed for a month with 3 kids and it was great. Good studio, nice garden, great people. The location is a bit off the beaten track; on the other hand the neighborhood is very plesant and quiet."
58506,2884986,2022-02-08,1690451,Niek,Mosman is a very nice place to stay when exploring the Sydney region. The studio is located in a quit residential area and with John's help we were able to use the public transport (both ferry & bus) to take us to the city center. There is also a nice beach nearby.
58506,2586045,2022-02-08,2490391,Helen,"Studio Yindi was excellent value for us we booked it for a month . It was well equiped , light and spacious . Ideal location to catch the bus 2 mins from apartment to go into the city . We had a car , but we did also use public transport . Everything you need is in the apartment , nice garden to sit in the evening , and watch the numerous birds , fruit bats , roost in the trees .  John and Pam were very nice and helpful hosts .Nothing was too much trouble for them , they are very knowedgable about places to visit ."
58506,2492714,2022-02-08,2822475,Amy,The reservation was canceled 29 days before arrival. This is an automated posting.
