listing_id,id,date,reviewer_id,reviewer_name,comments
58506,26448848,2022-02-08,25361616,Tim,"John allowed us to book in early and leave our cases  safe at the end. 
<br/>The room was very comfortable and meet all our needs for 3 days. John also helped us in finding good places to visit and was very helpful. "
58506,26040717,2022-02-08,1286226,Rodrigo,"We had a wonderful stay at Studio Yindi. John is a very friendly and helpful host. The location is perfect to explore the city, close to bus stops and comercial points. Sure we could stay here again."
58506,25840864,2022-02-08,23882372,Caroline,John was very welcoming and Studio Yindi was comfortable for our small family of 4.
58506,25626171,2022-02-08,4836995,Nikki,"Communication with John before and during our stay was excellent. He would always check if everything was okay.
<br/>The studio is exactly as described as are the photo's (I reckon it looks bigger in reality) and all the information John gives about (public) transport, sights etc. 
<br/>The bus stop just up the road was excellent for my mum (not too much walking) and takes you straight to Wynyard station where you can continue your trip from there. Apart from the city, we enjoyed cremorne point and a beer at the rowers. 
<br/>Our stay in Sydney was everything we hoped for and more.
<br/>Would definitely recommend studio Hindi and love to come again!"
58506,26971384,2022-02-08,11672711,Michael,We had a wonderful time at Studio Yindi - beautiful location and very spacious inside. The hosts were extremely kind and generous and went out of their way to give advice and help us navigate Sydney. Great experience!
58506,570559394096895133,2022-03-09,24089799,Damian,Fantastic place. Would stay there again
58506,574861804511299072,2022-03-09,8167115,Macarena,"We really enjoyed our stay at John & Pam's place. There was a lot of space to move around, which we appreciated as we were both working from the apartment. <br/>Communication was easy, and we loved the serenity of the neighbourhood, would definitely recommend it."
58506,566215164051745164,2022-03-09,406273583,Tony & Nanette,Very convenient location to Northern Beaches. Nice friendly owners.  Would recommend staying at Studio Yindi
58506,563954248539617738,2022-03-09,55345287,Anne,Quiet and very peaceful. The apartment was very spacious.
58506,561142755700940078,2022-03-09,30886881,Andrea,"Wonderful hosts, very friendly with great advice on things to do in the area. The studio is in an idyllic spot, amongst bush and peaceful. Clean, tidy and with all the amenities. We had a terrific time."
58506,597345126123747669,2022-04-12,298712891,Aki,Great location and wonderful place to stay. The host was very communicative and helpful.
58506,600971038687052589,2022-04-12,163772338,Yi Han (Hann),John is friendly and nice. The accommodation is accurate with the photos and spacious as well. I would recommend this place for a small group of friends or families. (:
58506,593724699227126506,2022-04-12,20051741,Samantha,John’s place was everything described and more. We loved our stay. Perfect location for a zoo trip and well set up for our young children. <br/>We will be back!
58506,591522588743337803,2022-04-12,296874804,Kathy,Description accurate. Lovely outlook.
58506,580658725495688314,2022-04-12,59282093,Peter,excellent location and very friendly hosts
58506,616963480116828812,2022-05-11,103595382,Caitlyn,Neat and tidy apartment with a well equipped kitchen and a lovely aspect over the garden.<br/>Helpful hosts with needs or questions.<br/>Beautiful quiet location in Mosman. A fifteen minute walk up to the shops for buses into the city.
58506,622673867144349916,2022-05-11,2058949,Emily,"Lovely weekend spent at Studio Yindi - listing was just as described and perfect for my family of four. John was a great host and welcomed us with a bottle of milk and wine. We will definitely stay again, thank you!"
58506,614811968861177167,2022-05-11,132377681,Karyn,Lovely hosts great set up in a good location.
58506,612529441984181048,2022-05-11,88856345,Adrian,"Studio Yindi is a fantastic facility, with good views, surprisingly spacious and for us it was conveniently located."
58506,611185022235956834,2022-05-11,195428922,Alana,"lovely hosts, great accommodation, great communication and really enjoyed our time there"
58506,609683211452859840,2022-05-11,29331196,Yvonne,Studio Yindi was lovely. Our hosts John and Pam were very kind and explained everything in detail. Only public transport is the bus but its frequent and super close so not an issue. Great value for the size and in a pretty location.
58506,608220083204042916,2022-05-11,139560608,Bronwen,"John and Pam’s place was a hidden and pleasurable place to stay, with easy interactions with the hosts and conveniences within walking distance."
58506,637276476926771671,2022-06-06,397891653,Johnny,"If you looking for a stay in Mosman, look no further -John is a great host, with first class communication and his space is great that ticks all the boxes."
58506,639404519191524707,2022-06-06,972240,Arianwen,"We absolutely loved staying at John and Pam’s place. It really is the perfect Airbnb, everything you could possibly need is provided, right down to nice olive oil and balsamic. We were there during a a cold snap and John made sure we had extra bedding. They even provided a little chair and table for our four year old to sit and draw. The place has stunning leafy views and a really welcoming feel. We hope to stay again! Thank you!"
58506,635823039049703364,2022-06-06,301739915,Maria Ysabel,Awesome hosts and a beautiful + affordable venue! Close to the venue and shops; lovely for a quick Sydney trip or a family vacation. John and Pam always made sure everything was alright and that we felt right at home (but better)!
58506,634376375452776953,2022-06-06,149934958,Alexander,"Good location if you’re staying doing things on North shore,  place was small but cosy with everything you need for a short stay. Great communication by host from booking till check out."
58506,632890345825650538,2022-06-06,160715341,Clarrence,"John's house was beautifully designed to fit travelers coming from all round the world, regardless of whether you are doing it with family or friends. The layout of the entire house is meant to provide the utmost flexibility for anyone to fit in perfectly, both for short and long-term stays.<br/><br/>I particularly loved the full glass doors and windows at the front of the house overlooking the small backyard! Although the TV could be slightly bigger, everything else was set up for anyone travelling both in winter or in the hotter months.<br/><br/>John himself was extremely communicative and responsive to every single query that I had, even coming down to meet us (he lives on the 2nd floor) and providing recommendations for local attractions. 10/10 would recommend to anyone looking for a quiet and beautiful house to live in Mosman, Sydney!"
58506,630683636303383750,2022-06-06,58304855,Rebecca,"Great communication with John. Quiet street. Bunk beds in the room were a little uncomfortable, very soft."
58506,624215143037845923,2022-06-06,448738503,Jaekwon,"Host was so kind and explain lots of things about restauran, mart, etc.<br/>Location is very good to travel the city. <br/>The room was so unique."
58506,620597176972395852,2022-06-06,403209659,Daryl,Exactly as described. A wonderful place with a very helpful owner. Would definitely stay here again.
58506,709654328888571537,2022-09-09,43646685,Visahan,"Our Stay was excellent, the location was perfect if you want to visit CBD often, but also not to stay in a congested area. Jhon gave some excellent suggestions regarding what places to visit, tried some of them and they were great"
58506,703212254587842449,2022-09-09,55235431,Jamaya,We had a lovely & comfortable stay at Johns place! Location was perfect for what we needed. Would recommend!
58506,701744359956200961,2022-09-09,377870001,Chantelle,John was a very helpful host.
58506,698788146174619897,2022-09-09,462703702,Athena,"We had a lovely stay, and this is  Great spot to explore North Sydney. John is very communicative and helpful, and his Taronga Zoo tips were top notch!"
58506,732125160469783929,2022-10-08,38355125,Margrit,"Wir nutzten dieses Studio um family in Sydney zu besuchen. Ist ideal gelegen, um zu Fuss einzukaufen, ÖV zu erreichen und Walks am nahegelegenen Wasser zu machen."
58506,723473988596790096,2022-10-08,9957847,Cindi,"Great location, big open style and it's great to look out at the view through those lovely huge windows! <br/>Queen bed is very comfy (if you like firmer mattresses), single beds could be better but kids wouldn't notice.<br/>Clean, with all things you need for any length of stay provided.<br/>Be aware that the studio is under the owners residence and there can be occasional noise."
58506,722086595822122126,2022-10-08,338465080,Petta,"Would definitely stay here again. Studio had everything available to make our stay comfortable, we were able to cook meals and had plenty of space to chill after busy days out sightseeing. Would recommend this stay to anyone."
58506,714003417169382385,2022-10-08,6054707,Elnaz,Thank you John- highly recommend a stay.
58506,749585802160608358,2022-11-03,23100541,Lani,"Convenient location, great on street parking which is very surprising in Mosman.  Well appointed property.  Value for money."
58506,744487704820969247,2022-11-03,81219503,Emma,"Nice green area with coastal walk. about 15min walk form the main street so keep that in mind for supplies. <br/><br/>The space gives strong shack vibes. Lots of books and coffee and tea options were provided, which was a nice touch."
58506,743063025632952100,2022-11-03,208425314,David,Everything you need
58506,740837450546314033,2022-11-03,48471871,Rachel,A treat. Felt so at home. Everything move and clean and comfortable. Will definitely stay again!
58506,738673583880621482,2022-11-03,449817298,Naresh,Stay was very comfortable. Location was great. Host was very helpful and accommodating.
58506,769776502258539340,2022-12-10,34895637,Jessica,"Studio Yindi provided a peaceful base for a family reunion.  Although it looks tiny on the AirBnb website, it is surprisingly roomy, and had everything we needed. John and Pamela could not have been more helpful and flexible to our needs.  We felt completely at home.  <br/>There is parking for a car on the street, and it is a short walk (although uphill in one direction) to the bus for the City, and all other points."
58506,774198278084841483,2022-12-10,5076840,Nick,"My family (wife and two children) stayed here for a week while we were in Mosman for a wedding. John was amazing at communicating, he even endeavoured to look for a babysitter for us, as we had no contacts in Sydney. <br/>The space is way bigger than the photos suggest, our kids loved the bunk and toys that were there. <br/>I went to a few other Airbnbs in Mosman during the week and this was by far the best value and our visitors who came for tea loved our little garden with a glimpse of the sea. <br/><br/>Staying here feels like staying at a family friends house. It’s not glam, but you are at ease with how welcome and comfortable you feel. <br/><br/>There were a few cons- there is a lot of construction noise coming from the renovation next door. We were out all the time so it didn’t bother us. <br/><br/>Overall it’s value for money and couldn’t rate John’s responsiveness and attention to us more highly."
58506,768424236178904406,2022-12-10,47818976,Casey&Maria,"Studio Yeti, has  all the basic things you need, it is like being at home away from home. It is a beautiful sized studio for a family of four. Our children loved the bunk beds, and the outside yard, though small it has a beautiful view with so many beautiful trees. We have stayed in a few Airbnb's and this one is definitely one of our favourites. The location is perfect! for getting to see Sydney's best.  Also, a great Playground for small children, like ours, is just 5 minute walk away from John and Pam's place, and there are some great restaurants and take out places we discovered. John and Pam were also great hosts! very friendly,  and kind, and got back to us quickly when messaging them. Thank you again John  and Pam for a great weekend getaway!  We will definitely recommend Studio Yeti.  :)"
58506,766952702741832109,2022-12-10,264907584,Julie,"We had the most amazing time staying here! The studio is very spacious and located in a peaceful part of Mosman. John and Pam are some of the most welcoming and friendly hosts I’ve ever encountered, and gave us many recommendations on what to do and see. Easy and quick communication. Highly recommend staying here if you’re going to Sydney!"
58506,764058769800028816,2022-12-10,79604848,Navneet,Loved the stay! Place is apt if you are coming to Sydney for the first time. Can easy drive to all the attractions within 15-20 minutes drive. <br/><br/>Neat- Clean- Tidy & Beautiful
58506,762604147761387721,2022-12-10,367945425,Sue,The accommodation was perfect for our requirements. A well appointed & functional unit in a quiet setting. We had a wonderful time exploring this beautiful area.
58506,758942233734537124,2022-12-10,6281629,Nyree,"A great spacious, light and airy space with privacy."
58506,787990521763770303,2023-01-09,376239270,Julie,This location is amazing. The view out the floor to ceiling glass wall at the front of the unit is beautiful. The hosts are very helpful. The garden is lovely.  The kitchen has so many cooking items. We loved our stay there. Thank you
58506,781392646277513774,2023-01-09,12628838,Anna,John’s a great host and made sure we had everything we needed both before and during you stay.
58506,779259900582593031,2023-01-09,173099210,Oscar,"Espacio y ambiente fantástico<br/>La atención y comunicación con John fue extraordinaria<br/>Regresaría a este lugar, sin duda."
58506,795928346331958287,2023-01-09,408519249,Pauline,sehr schöne unterkunft in netter lage. zwar etwas außerhalb von sydney aber dennoch gut mit den öffentlichen verkehrsmitteln zu erreichen. die gastgeber waren sehr nett und hilfsbereit.
58506,820563612543691237,2023-02-08,26953771,Janet,We had a lovely one week stay at Johns place<br/>Lovely location with lots of wildlife<br/>The studio was bigger than expected and it was easy to cook there<br/>We enjoyed the outdoor seating area and ate all of our meals out there<br/>About an 18 minute walk to shops but there is a local bus that goes around every half hour<br/>We walked to the beach in about 25 minutes but there is a regular bus there from Spit Junction<br/>We would stay at Johns place again in the future
58506,815466343174602722,2023-02-08,38133196,BoHee,"First of all, thanks to Jhon and Pam. They provided a great accomodation like a home. Mosman is very nice place in sydney. We went to the beaches which is  Manly and Balmoral everyday. I feel healing       while I stayed there. That place is natural and convenient. He let me know lots of good place near area. Jhon replyed very fast when I had wondering. I will stay again If i go sydney. Take care lovely family."
58506,808212871800183593,2023-02-08,118602750,Melissa,"Studio Yingi was a great base for us girls to rediscover the Sydney of our youth. We had so much fun! The place has a cosy vibe, cute garden, located in a beautiful suburb. John and Pam made us feel very much at home. I'd definitely recommend this place to any small group visiting Sydney. Cheers."
58506,804609216737000377,2023-02-08,36178764,Safwan,"The studio is spacious and has great amenities, with a leafy backyard to boot. We couldn't help but notice the same colourful parrot feasting on a bottlebrush tree over the 4 days we were there.<br/><br/>Location wise, it's in a peaceful part of Mosman yet still within driving distance to railway stations and walking distance to bus stops. There are also supermarkets, cafes and restaurants a short drive away.<br/><br/>John and Pam were great hosts who greeted us when we arrived. They also left plenty of pamphlets and guides which we found very useful.<br/><br/>All in all we had a very pleasant stay at Studio Yindi. Thanks John and Pam!"
58506,800971968367572743,2023-02-08,246859986,Brendan,John was very welcoming and provided some helpful tips throughout the duration of our stay. Studio Yindi is in a great location with lots to see and do in the area. Thanks for a relaxing stay John & Pam.
58506,839411982751650345,2023-03-13,22808161,Sabine,"Super well located, nice airbnb in Sydney"
58506,845962232457930401,2023-03-13,20993282,Delphine,You won’t be disappointed. <br/>Spacious and comfortable studio. Everything you need to relax after a day of visiting Sydney.<br/>John was very nice and did his best to make our trip easy.<br/>Highly recommend.
58506,835081701062410468,2023-03-13,75871974,Patrick,"Lovely location, comfortable and relaxing, great hosts, would of loved to stay longer. Hope to return in the future. Thank you"
58506,833666022583669091,2023-03-13,98246945,Paul,Our only concern was with the noise created by the building works next door.
58506,828564623473698036,2023-03-13,444175162,Tilde,"John and Pam are very helpful and give lots of instructions on activities, shopping etc. The place was ideal for us travelling with three children. Play ground close by. Easy access to the city by bus but quiet area with villas. Interesting garden to explore for the kids."
58506,824899886697238806,2023-03-13,481094997,Koji,とてもリラックス出来る施設でした。<br/>また泊まりに行きたいです。<br/>ありがとうございました。
58506,822754766671331249,2023-03-13,43087680,Zan,John went above and beyond for us. An outstanding stay that I can't fault.
58506,858961111571346753,2023-04-09,488785218,Charlotte,beautiful stay with lovely lovely hosts who were willing to help at any given time ! located in a beautiful area super close to transport and local shops whilst remaining peaceful and away from the major hustle and bustle of Sydney:))
58506,864765193925373404,2023-04-09,416631642,Astha,Very friendly host and beautiful location
58506,856082019119170922,2023-04-09,40550256,Jared,"Very friendly hosts - provided a stroller for us to use which was very thoughtful. <br/><br/>Very stuffy space, just one fan and no screens on windows/doors for airflow, luckily it wasnt hot when we were there would imagine it could get uncomfortable. <br/><br/>Basic kitchen applicances quite dated, took forever to cook on the plug in hotplates and a very small tv for such a huge space. <br/><br/>However was good value for money in the Sydney area"
58506,851779552732649832,2023-04-09,19384448,Dinah,The studio was beautifully located with a lovely garden. It was well equipped and comfortable. Pam was friendly and helpful. We'd love to stay here again when we're next in Sydney.
58506,849603974690542454,2023-04-09,490919133,Joshua,Nice cosy place in a beautiful neighbourhood. Friendly host who communicated clearly.
58506,847349535555469333,2023-04-09,45470526,Olivia,"Charming place at a wonderful location for an unbeatable price... cannot recommend this airbnb highly enough. It was the perfect two days for our group of four, and John was extremely welcoming and friendly. We will return soon!"
58506,880718994342926172,2023-05-12,3720353,Ashley,"great place, easy street parking, check-in was easy with clear communication and John very welcoming. The space was bigger than I expected from the photos, nice little grass area outside and a leafy outlook through all the glass panels while still being private. <br/>You can hear the day to day activity in the house above, just something to note if you are a light sleeper. <br/>we stayed for a wedding nearby and was a great base to have."
58506,887217775115986849,2023-05-12,256920380,Krisel,John and his wife welcomed us and made sure we had a great stay. It was cold at night and they made sure we had a 2nd heater. There was some construction beside the place but other than it was great
58506,879340910867388469,2023-05-12,12337597,Valentine,"Lovely place with lots of sunlight and more spacious in reality than on pictures. Quiet area, easy to park. Excellent communication with John, very helpful and flexible."
58506,874967319902874317,2023-05-12,93777582,Stephanie,"Loved our stay at Studio Yindi. Great for families, our kids loved sleeping in the bunk room and John has provided some toys and a lovely outdoor area for the kids to play and adults can relax watching the sunset. The studio is very spacious and comfortable. Fully equipped kitchen and study area where we could set up our laptop. Lovely location, close to shops and public transport. We caught an Uber to Mosman Bay Wharf (for $10) and traveled around Sydney by ferry. John is a lovely host with great communication and provided lots of information about the area. Up there as one of the best Air b n b’s we’ve stayed in. Won’t hesitate to book again when travelling to Sydney."
58506,872766406598049792,2023-05-12,55090400,J,"We enjoyed our time at John and  Pam's studio. It is comfortable and clean. John and Pam are great hosts, who are helpful and friendly. We used 243 bus to get to CBD in the morning;  came back by ferry and connection buses at Neutral Bay and Mosman Bay.<br/>We would love to stay there again when we return to Sydney for another visit."
58506,870579553840908129,2023-05-12,65541174,Ros,"Good location, a quick bus ride to the city. Parking nearby was easy. 30mins walk to shops or a short drive. Parking can be challenging near local shops & restaurants. Lovely garden, the studio looks on to the garden. No street noise, very quiet. A few stairs to studio, requiring careful navigation at night."
58506,867724685130462516,2023-05-12,255385066,彬,非常好的入住体验，房间非常干净且实用。
58506,866212039444185264,2023-05-12,412144450,Davic,Perfect!
58506,905363857793190828,2023-06-06,6936225,Eileen,"We had a nice stay at John and Pam’s place. It was very spacious for the kids and there was hot shower. The kitchen was well equipped and we could cook too and wash our clothes. Pam was nice to came out to look for us when we couldn’t find parking when we arrived due to nearby renovations. Appreciate the nice gesture. Love the location as there are supermarkets, cafe just a short drive away and Taronga Zoo is also a close by."
58506,902540537568969434,2023-06-06,101790402,Loic,"Very nice studio, perfect for a family! Everything is in perfect conditions, and John and his wife are really helpful and flexible. <br/>I recommend John’s flat."
58506,896669737291692963,2023-06-06,93990657,Flora & Holger,Great space especially for families! We had a great weekend staying here!
58506,894562605365710467,2023-06-06,95655104,Romeo,"Really a great place, we enjoyed our stay thoroughly, except for lack of Centralized heating and lack of curtains. John and Pam were very friendly and went out of their way to say ""Hello."""
58506,892341733805351373,2023-06-06,231388186,Kay,Nice large space with garden and everything you need for a good stay. Bus stop 1 min walk and very easy access to city. Great quiet neighbourhood and street with off street parking. John provides good information for local eating and walks. I would recommend this accommodation.
58506,972768066270141843,2023-09-04,171554024,Grant,Great location and great hospitality.
58506,962629436585741919,2023-09-04,133362988,Oli,Had a lovely stay at Studio Yindi! Beautiful location and John is a very friendly and helpful host
58506,961235093202061305,2023-09-04,520431547,Jy-韵,房东很好，房子很干净，景观也很好，是一个很不错的体验，非常谢谢房东夫妇。
58506,957598929452884705,2023-09-04,58115768,Kelvin,"Nice, clean and lovely environment with a friendly host."
58506,977824386753042936,2023-10-05,23326847,Nyree,John’s place was spacious and comfortable. It exactly matched the description and photos and suited our needs very nicely. Located in a very pretty area with good access to transportation.
58506,975696529939420221,2023-10-05,528390818,Jenny,Thank you to my hosts. Great Great place
58506,1016207501938243341,2023-11-10,523522318,승화,"예쁜 마을에 있는 예쁜숙소입니다. 잔디밭이 잘 관리된 마당이 있어서 너무 좋았어요. 주변 집들도 예쁘고 호스트가 2층에 살고 있어서 깨끗하게 잘 관리되었습니다. 웰컴드링크로 와인과 우유를 주셔서 너무 감사했고, 한국인이 좋아하는 양념소스를 제공해주셔서 잘 먹었습니다! 아이와 잔디밭에서 아침마다 놀고, 놀러온 예쁜 앵무새를 보는 것도 좋은 추억입니다. 시드니 중요명소와 가까운 거리에 있어서 편했고 주변에 마트도 쉽게 갈 수 있어 좋았습니다. 매우 추천합니다!"
58506,1013373832543656874,2023-11-10,542348581,Jodie,John and Pam hi so welcoming we had an absolutely pleasant stay and we look forward to visiting Mossman very soon
58506,1006833369437370579,2023-11-10,450970526,Myoungjun,"Even though it was my first time visiting Australia, I felt comfortable and received complete explanations.  John's guidance was always friendly and detailed.  The accommodation was more than I dreamed of.  <br/>The garden was beautiful and fragrant.  The sunlight shining into the living room is warm and comfortable.  The bed is comfortable and clean.  The kitchen is clean and has many things prepared.  <br/>My family and I had a perfect trip to Sydney thanks to John."
58506,999628405845870666,2023-11-10,272686776,상현,"everything was good in mosman.<br/>john and pam are so kind . whatever we need, they handled it. <br/>I've stayed for 1 month in sydney. the balmoral beach near this airb&b was my favorite."
