listing_id,id,date,reviewer_id,reviewer_name,comments
58506,159852,2022-02-08,287371,Erna,"My mother and I had a delightful time at Studio Yindi. If you like the clean lines of modern architecture, a full view of a walk out garden, big city sites. beaches for swimming, trails for walking and endless shopping all within minutes this is the place for you . The birds singing will greet your day and the quite surroundings act as a perfect relaxing environment after a day of business or sight seeing.
<br/>Pam and John are perfect hosts ready to assist you when and if you choose."
58506,241897955,2022-02-08,3159702,Christine,"Great place to stay with kids if you are not always out and about but is also looking for a place where you can just chill on a  good day. There is an excellent playground up the road (5 min walk) and bus 423 will take you to the city in 20 min (only run once every hour so make sure you plan). John was very friendly, quick to reply and helpful in any way!"
58506,239705627,2022-02-08,153055762,Fahad,"We stayed at Studio Yindi with our two children for a complete month. It has a comfortable environment in a beautiful setting, an intelligent design to accommodate up to 4 people and all necessary arrangements to help you settle-in quickly. We found the public transport reasonably accessible as well. John and Pam's hospitality was exceptional. Thoroughly enjoyed our stay at this place... highly recommended!"
58506,230746697,2022-02-08,156694231,Stephanie,Lovely place and great location!  John met us as we arrived and showed us around.  I loved our backyard bird visitors!
58506,230059852,2022-02-08,148184643,Felicity,John's villa was perfect for our family's short stay in Sydney. The location was amazing and close to Balmoral beach which our children enjoyed.  John was accomodating and did what he could to make us feel welcome. We would love to stay here again. 5 stars!
58506,229096464,2022-02-08,60828871,Vivek,"Johns place is located in an affluent harbourside suburb with so many boutiques cafes and bistros along Military Road. My family really enjoyed their stay at this accommodation. <br/><br/>It has great ferry and bus connectivity to the city and John on the first day , drove me around Mosman to show me local grocery stores and places where I could buy basic amenities for my stay."
58506,228052852,2022-02-08,44445208,Christophe,"Le studio est dans un quartier calme de Mosman, à 20mn en bus du centre de Sydney. Un bus passe dans le rue au dessus toutes les heures. On peut aussi rejoindre la ville par le ferry en rejoignant Mosman bay en 10mn en voiture.<br/>Le studio est lumineux grâce à ses grandes baies vitrées.<br/>Il est équipé de deux pièces attenantes, une salle d'eau avec douche et WC et une petite chambres avec un lit double.<br/>Dans le studio, il y a un coin aménagé pour deux lits simples. Ce coin est isolé du reste du studio par quelques meubles bas. Il manque un rideau pour obscurcir cet espace de nuit.<br/>Le salon est vaste et agréable.  On y trouve deux canapés, quelques rangements et une télé.<br/>La cuisine est équipée de deux plaques électriques, un micro ondes et un grill pain. on trouve aussi une machine à laver récente. Il est facile d'étendre son linge. Les couverts et les verres sont en nombre limité. Les accessoires et ustensile de cuisine sont nombreux.<br/>John est un homme présent, aimable et serviable. Il est aussi de bons conseils. Nous avons apprécié notre séjour dans le studio."
58506,226474452,2022-02-08,33360953,Nicolas,Super studio idéalement situé. À 20 minutes de la cbd en bus. John est très sympathique. Il nous a conduit au supermarché le jour de notre arrivée. Il nous a ensuite prodigué de nombreux conseils.
58506,225236101,2022-02-08,37898620,Adeline,"Appartement spacieux dans quartier résidentiel chic. Bus à 2 min à pied, qui dessert directement le CBD. Supermarchés proches également. Petit jardin, bouteille de vin en arrivant, wifi, cuisine, nous avons réellement apprécié cette semaine passee chez John. Il'a été très réactif et super accueil. Nous recommandons à 100%"
58506,222474594,2022-02-08,5950025,Michael,John and Pam were excellent hosts. They were thoughtful and considerate in their small personal touches and communicative and accommodative both in the lead up and during our stay.<br/><br/>Highly recommended!
58506,221236378,2022-02-08,46265401,Steven,John was a very helpful host and the place was a good size space to stay.
58506,220138237,2022-02-08,18210689,Diane,Good quiet location
58506,219173514,2022-02-08,126167594,Stuart,"Good location, lots of room"
58506,218615311,2022-02-08,26151644,Kelley,"John was a great host. Quick to respond. In the studio was lots of maps, information about buses etc. This was handy to have. <br/>We were travelling with our 2 children and this studio was perfect for us. Easy walking distance to the buses to the city. Was lovely to come back to somewhere peaceful in the evenings. John was great and gave us a lift to the ferry in mosman bay to get to circular quay. If you get a chance go to balmoral beach for the fish and chips. It is a 30 minute walk from the studio (the walk back is tough as up a huge hill). <br/>The studio was equipped with everything we needed. Would definitely recommend."
58506,216455534,2022-02-08,77437521,Ian,"Fantastic location, great sIze, very welcoming host. Thanks for a great time, John! Ian and Di"
58506,215298521,2022-02-08,156210173,Leon,John is a very friendly helpful host. Very quick with email replies. The property was ideal for whatbwe needed it for. The only slight downside is the transport into the City from the area. Which isn't anything to do with the property.
58506,243982410,2022-02-08,128905253,Jason,"Lovely light filled studio, well located and family friendly"
58506,214924900,2022-02-08,76902663,Eleisha,"Great space, lovely suburb, John was fantastic and really helpful to ensure we got the most out of our stay. John even had a soccer ball for our boys! Recommended."
58506,245563554,2022-02-08,173413506,Caroline,Nice place to stay. Great communication before our arrival and John gave loads of local tips when we arrived. Garden is lovely and you have your privacy but John and Pamela are on hand if you have any questions.
58506,248178617,2022-02-08,74245586,Tim,"This is just an amazing find - a perfect haven with great access to the centre by bus or ferry.<br/><br/>Perfect hosts, lovely thoughtful touches, easy check-in and comfortable beds.<br/><br/>Great value for money to boot!"
58506,349614861,2022-02-08,2767268,Sarah,We had a great stay at John and Pam’s home. The house had a light and modern fresh feel to it yet it was perfect and very comfortable for our young family. John and Pam were both more than willing to give us help and suggestions of what to do and how to get where we wanted to go. We really enjoyed our stay and hope we can come again!
58506,347151444,2022-02-08,210424638,Gillian,"Lovely peaceful studio, beautiful surroundings and lovely garden. Spacious and nice atmosphere, centrally positioned for visiting Sydney and surrounds."
58506,345743535,2022-02-08,89839396,Sébastien,"John's appartement is perfect for a family or a couple in a very calm place of Sydney. You can easily travel with the bus from there to the different interesting points around. John is a really good host, he helped us the first day for the bus and gave us useful information about Sydney. For sure I'll take another time this appartement if I come again in Sydney."
58506,341821469,2022-02-08,30510205,Emma,"Very limited kitchen by Australian standards,  no oven and only a bar fridge. Ok for a night or 2 but an extended stay with a family would be difficult."
58506,338546278,2022-02-08,208031064,Abhishek,Awesome host. guided us for things to do or not/places to visit.<br/>A perfect home for long or short term stay... Perfect place to stay- put if you have ur own vehicle... however place is well connected by govt buses.
58506,336065918,2022-02-08,8310825,Angela,During my stay I needed to decorate a cake and all the amenities in the kitchen were all available. Good heating and comfortable beds.
58506,333129970,2022-02-08,110724018,Natalie,"John’s place is comfortable and has everything you need- a home away from home. We travelled with 3 young children and we found the accommodation perfect for our needs. <br/><br/>John and Pam respected our privacy however were friendly, hospitable and provided great tips for things to do around Sydney with young children (on a couple of very wet Sydney days). The little backyard area was just gorgeous and the children loved exploring. <br/><br/>So close to public transport, supermarket and of course to the City centre. <br/><br/>We’d highly recommend John’s place to a family with children who are looking for a base for a Sydney getaway."
58506,331170609,2022-02-08,28030119,James,John is very affable and informative. It is a brilliant location.
58506,327487200,2022-02-08,189007887,Lesley,The Studio is well situated with easy access to public transport. John is a helpful and considerate host and the Studio contained everything we needed for a comfortable stay. We will definitely stay again.
58506,323545738,2022-02-08,5512904,Alex,"Great value, perfect and secluded little  get away"
58506,280279609,2022-02-08,166619087,Natasha,"Pam and John are excellent hosts.  We came from the UK and John was there to meet us and get us settled in. They checked up on us every so often to make sure we were okay and needed anything.<br/>The space is homely. Its not a sparkly shiny hotel, but a lived in studio apartment.  It has the amenities you need - Kettle, fridge, washing machine, basic cooking supplies, beds, shelves, sofa etc. We stayed for 5 weeks with no  issues. There is a nice backgarden for the summer time. The location is outside of the city center - it is a 15 minutes bus ride to the city from the bus stop at the top of the road. <br/>We would recommend this studio :)"
58506,264472305,2022-02-08,64820994,Vivian,thanks for john and Pamela's.these 2 beautiful days will keep in my mind for a lonnnnng time: the beautiful fireworks we watch in your sofa，the beautiful green views out of the living room，the small paths beside your house，and the two lovely people:the accommodating gentleman and the elegant lady.<br/>i will give a 5star recommend on this journey~ you can drive to city center injust15 minutes ，or by bus is also very convenient. it's quite and beautiful and safe. i love here， you will also^_^
58506,257632285,2022-02-08,80906390,Vicki,Fabulous apartment in a great area. Easy to get the bus into Sydney and great range of shops nearby. <br/>Pam and John were fabulous hosts giving us lots of local tips and even a couple of lifts which made life very easy! <br/>Would definitely recommend.
58506,254971177,2022-02-08,175566847,Kay,"Friendly & helpful hosts.<br/>Great location, private & quiet.<br/>Spacious living area."
58506,251957098,2022-02-08,24314771,David,"Quiet, peaceful and private location. The only noise in the morning was the kookaburras, which we loved."
58506,247257519,2022-02-08,14745445,Peter,"John provided really good communication prior to our arrival, so there were no problems when we did arrive. We were only in Sydney for a couple of days to catch up with friends who were also in town, so we did not spend a lot of time in Studio Yindi. The accommodation was all that it said it was and it had everything that was needed."
58506,213398437,2022-02-08,101187704,Georgina,Very happy with our stay. John was helpful.  Our kids loved all the wildlife in the garden.
58506,206749195,2022-02-08,53927343,Sandra,"Gorgeous, light space and the greatest hospitality a young family could wish for. So kid-friendly! Also fantastic neighborhood which was easily discovered thanks to all the great tips and support John and Pamela gave us. Amazing people!"
58506,204379939,2022-02-08,17180478,Kate,"Room studio, quiet yet convenient location. Excellent value for money."
58506,131314748,2022-02-08,28486634,Olivia,"Great value, very good location. Very nice apartment at the back of the house. Plenty of spaces to park the car. Great host with easy and quick communication. We'll definitely come again!"
58506,130146950,2022-02-08,100798656,수영,The host is very kind. <br/>one episode. we had to arrive home at 10 pm. He gave us a ride to the nearest store so we could buy some food.
58506,126872370,2022-02-08,62415129,Mary Grace,A lovely basic accommodation Great  helpful hosts Need car as ground is hilly  <br/>There are frequent buses to city and elsewhere but mostly you have to walk uphill to Military road If using a car there is no problem Within easy reach of city and beaches too!
58506,122761184,2022-02-08,91404330,Кристина,"I would like to say thanks for John and for him worrying about our staying in the apartment. Everything was clean and ready then we arrived. Thank you for good communication and explaining of all details in public transportation, locations, great places for visiting in Sydney."
58506,121941574,2022-02-08,10710557,Kali,"John and Pam were very welcoming and helpful in suggesting activities when the weather wasn't what we expected. I especially appreciated the loan of rain gear and warmer clothes. There are buses nearby, though not as frequent as we would have liked.
<br/>The studio was well appointed with everything we needed for our stay. And the beds were comfortable."
58506,120799646,2022-02-08,23431798,Hanzi,"John and Pan are very nice, my family and me all felt  warm welcomed. Studio Yindi locates in a quiet and safe neighborhood. It is highly recommended."
58506,116085671,2022-02-08,91771443,Carol,"John was very welcoming and a has wonderful local knowledge.  The apartment is very comfortable, private and quiet, with a lovely garden and outdoor seating to enjoy. It is quite an exclusive area of Sydney, but could be difficult without a car.
<br/>We would love to return and have time to do more of the harbour walks in the area."
58506,115449264,2022-02-08,50842522,Liane,John was a fantastic host. The apartment is in a quiet street but still very central. The photos are definitely representative of the apartment which is quite roomy and has everything you need for a short stay. Thanks John! 
58506,114641436,2022-02-08,96523598,Damienn,"We loved this place. My wife, kids and I had a great time here and were pleasantly surprised with how beautiful the lush the outlook was from the studio. We fell in love with the Mosman area which was also a surprise.
<br/>John was very helpful and an excellent host. "
58506,114225048,2022-02-08,52901759,Gary,Excellent accommodation and John was very helpful
58506,113047291,2022-02-08,84976979,Christine,"Great space - convenient for exploring Sydney, and perfectly comfortable for our needs. Parking for our rental in the street nearby, and (very handy access to the bus system). A great visit - John was more than helpful and accomodating to our travel plans. Thank you!"
58506,112748017,2022-02-08,19304678,Haley,John was very welcoming and accommodated our late arrival. The place was perfect for what we required and although our stay was short Studio Yindi made it so relaxing when we were able to spend time there. Would love to stay again. 
58506,111829657,2022-02-08,70108666,Mirkka,"John's place was a good place for checking out the city. Busses run close by, and the modest apartment has everything you could need. "
58506,110903681,2022-02-08,76710782,Evelyne,"Notre hôte a été très accueillant, il nous a donné plein de bons conseils et de bonnes adresses pour manger
<br/>À notre arrivée il nous a emmené en voiture pour nous montrer oú faire nos courses et comment se déplacer depuis chez lui
<br/>La maison est situé dans un quartier charmant de Sydney, vallonné et donnant sur une des nombreuses baies
<br/>Le studio est confortable et simple, les transports en commun sont rapidement accessibles mais attention ça monte !
<br/>Les propriétaires habitent à l'étage de la maison et le studio est situé sous leur terrasse qui est très grande.
<br/>Tout ce qu'il faut pour visiter en 4 jours Sydney 
<br/>Merci encore à John pour sa gentillesse et son accueil"
58506,109995876,2022-02-08,99284963,Lisa,"Lovely, no fuss, clean, quiet accommodation over-looking a glorious sunlit garden. The bus to the city is 50metres and only a short 15min trip to the city. John provided helpful travel tips and was very easy to communicate with."
58506,136018508,2022-02-08,26229742,Brooke,"We enjoyed our stay at Johns.  This is good accommodation, especially if there is 4 of you, keeping in mind there is 2 single bunk beds & a double bed.  Being surrounded by garden was lovely & we felt safe being there.<br/>Thank you "
58506,136635587,2022-02-08,10529728,Stan,"John's apartment was quite comfortable to stay in, with a beautiful view. It's not that close to shops, but is just a short uber from the Taronga ferry. "
58506,138054535,2022-02-08,69736679,Kryštof,"Apartment was not ready on time even, that host asked on time of arrival. First day host told us, that wifi is down and he will buy new router..wifi was available after 6 day from 7 day stay. All apartment was not cleaned well ( tile, carpet, couch, toilet, etc.). Towels which was available from host was used too much..dirty spots. Decription of the apartment was different from reality. It was not private apartment, but almost shared flat with host."
58506,139137555,2022-02-08,11096327,Luke,"John is an excellent host and offers his vast wealth of knowledge on Sydney and the surrounding area. Is fair to say that Mosman is a very wealthy and upmarket part of the city, 100% safe and friendly. <br/><br/>The apartment is located under Johns house and offers a vast living area for the money. The kitchen is basic but you could cook a simple meal, the local restaurant choices are extensive and of excellent quality. The 243 bus leaves for Sydney CBD at the top of the road which is a couple of mins walk. Get yourself an OPAL card for easy, stress free public transport.  <br/><br/>If you have kids (like us) the apartment offers an excellent alternative to a hotel as it gives you the room to spread out. <br/><br/>I loved my stay in Sydney and Mosman has some fantastic beaches, so don't hesitate to book this place as for the money it's a bargain "
58506,202765094,2022-02-08,97749571,Leonard,Great space. Hosts very good at communications let us check in a bit earlier which was welcome after long flight. Location nice and peaceful a bit like rainforest feel with birds chirping etc. Easy to get anywhere  . would use again if in Sydney
58506,200849077,2022-02-08,134640746,Paran,My parents were especially pleased.<br/>Mosman is a good neighborhood for a walk every day.
58506,199421921,2022-02-08,146090957,Andrew,"John and Pamela were relaxed, friendly and accommodating. A great introduction for us to Airbnb."
58506,198577401,2022-02-08,963235,Lynne,"We were on holiday in Sydney for a week (2 adults, 2 children). We chose this accommodation based on past reviews and have to say the accommodation was ideal and in a fantastic location in a quite suburb. Transport into the city was a 20min bus ride from a stop just metres away. As we had a car we also used the Mosman ferry terminal which was a 10 min drive and the views into Circular Quay were amazing. <br/>We had all the facilities we needed and John and Pam were the perfect hosts,  with nothing too much trouble. If your looking for a great air bnb experience in Sydney look no further."
58506,194983239,2022-02-08,39701800,Ikhwan Aizuddin,Location is great for public transport. Very quiet neighbourhood for relay your mind. All facilities in the house in good condition.
58506,192110916,2022-02-08,24736613,Rebecca,"Thanks John, we greatly enjoyed our stay"
58506,156258822,2022-02-08,39014097,POh,"Studio Yindi has been a great 7 night stay for my family of three. Excellent view, near to bus stop that will bring you to the city, comfortable beds & basically a great place to chill for family a vacation. <br/><br/>John was very friendly and helpful; giving us advise, being really flexible with our check-out timing etc. Would totally recommend you to stay in his apartment! <br/>Thank you John for hosting us:)<br/><br/>Cheers:)"
58506,355818950,2022-02-08,46266104,Mazen,He is a great Aussie host.
58506,153351747,2022-02-08,129957709,Allison,"Lovely view, beautiful area"
58506,151080353,2022-02-08,126823078,Lara,Thanks John for everything. Great location. 
58506,149354819,2022-02-08,40469885,Valentine,"Confortable studio, close to The transport and John is very attentive to your need<br/><br/>(Sorry for The bad english)"
58506,148061253,2022-02-08,23007046,Jessica,We had a lovely stay while in Sydney for a workshop. Would visit again.
58506,145576867,2022-02-08,19769451,Asa,"We had a great couple of nights' stay at John and Pam's place. They were very helpful hosts who communicated well and answered any questions we had, particularly with regards to transportation. The accommodation was roomy and very functional and peaceful. Stepping out in the local area was beautiful, and we discovered a good playground nearby. "
58506,144457625,2022-02-08,113942155,Sungeun,"John was very kind and friendly. <br/>Really nice host.<br/>My friends and me had really good time in John's house.<br/>It's a beautiful,quite,clean place.<br/>We met cute and pretty birds every morning and saw many stars twinkling up in the sky every night. <br/>We will never forget this momories."
58506,141968544,2022-02-08,70268052,Eric,John's place is absolutely incredible!<br/>He was very nice to welcome and say goodbye to us during check-in & check-out.<br/>Lots of toys are available for our kids in the apartment and the garden.<br/>The proximity to the city cannot get any better and the view is beautiful. I was given a brief overview of the nearby history of the area and recommendations which was very helpful for being a first-timer in Sydney. The room and apartment is clean and good location to many places with plenty of fun things to do within the city. <br/>We would definitely stay here again.
58506,139900510,2022-02-08,17173448,Tom,John is a very helpful host. The accomidation is clean comfortable and with enough room to spread out and enjoy the view.  
58506,151714098,2022-02-08,76221361,Joseph,"Great place, great location and great bloke. Highly recommended."
58506,109479128,2022-02-08,5051134,Deborah,"John made us feel very welcome immediately. We liked it when he told us stories of the area and also his own family and work history. The space is so light and airy and was a great place to relax and rejuvenate before our family wedding event. The beds were very comfy, and John even found another mattress for us when we needed it. "
58506,359986722,2022-02-08,187264334,Agata,"John and Pam are open, friendly and most helpful hosts. You will get all the tips you need to visit most interesting spots in Sydney. You can count on a pleasant chat every day. The studio is clean and has all the appliances you need to spend there holiday with kids."
58506,366585604,2022-02-08,117161804,Ronnie,"Johns place in Mosman was perfect for I and two friends. It was easy to get there and it was in a quiet and beautiful area. It was close to stores and the beach of Balmoral was just a short walk away. It is quite cheap taking an Uber into the CBD of Sydney or take the ferry and see Sydney from the water. John was very helpful and always answered fast if one had any questions. If you are looking for a place that has space, not in the middle of everything and is affordable this is the place."
58506,764572262,2022-02-08,22964829,Rebekah,Lovely location and great accomodation. Thanks John!
58506,741376067,2022-02-08,80075849,Melissa,Floor to ceiling windows that warp around the majority of studio giving you a magical view into the nature that abounds. The place has a very bohemian feel which to me is very Los Angeles. It’s roomy and it’s very private. You get a lot space for the price.
58506,717284677,2022-02-08,164167833,Karren,John’s place was great excellent location lovely accommodation good communication
58506,715062268,2022-02-08,2626059,Damien & Phoebe,"Perfect place for our weekend in Sydney with our two young boys. Really big spacious Studio, and with separate bedroom with the boys' bunks which was great for the evenings! Gorgeous location. Really well fitted out with everything you'd need, some great local tips and thoughtful little touches - bottle of milk, tea & coffee etc etc. John was also very generous with early check-in/ late check-out as they had no one either side of us - much appreciated. Overall, great little find!"
58506,714195739,2022-02-08,5428167,Fede,"Fantastic views, the garden is great for little kids. The place is located right in the middle harbour, very close to beautiful trails and schools. The hosts are very kind and generous, they have created a beautiful home for travelers."
58506,661975921,2022-02-08,99639740,Bob & Liz,John's place is light and spacious with a lovely view. John and Pam are great hosts.
58506,643130440,2022-02-08,9475705,Guy,"Fantastic place... one of the best! Clean, comfortable, stocked with everything terrific hosts and a great vista."
